🙂,🙂,맛있어요 
커피와 차가 맛있어요,굿,전에 고기가 맛없다고 리뷰했었는데.. 저녁을 뭘먹을까 고민하다가 우연히 이곳 리뷰를 다시 보게 됐습니다. 칭찬 리뷰들도 많아지고 올라온 사진들을 보니 고기질이 확연히 좋아진것이 느껴져서 다시한번 방문하게 되었어요. 그런데 이게 왠걸요.. 전보다 확실히 맛있어 졌네요. 놀랄정도로요.  특히 꽃갈비살이 정말 최고였어요.. 육대장이 바뀌었나 여쭤보고 싶었는데.. 오지랖인것 같아서 참았습니다. ㅎㅅ ㅎ다행이네요.  이곳 생기기전 비어있는 상가일때.. 아 여기  한양화로 들어와라.. 한양화로 들어와라 매일노래를 부르다 생긴것에 기쁨도 잠시 고기 질에 너무 실망했었거든요. 그런데 ㅋㅋ 이제는 남친과 꽃갈비살 먹으로 여기로오자 다짐까지 했습니다. 양지물냉면에 꼭 한번 드셔보세요. 사진이.. 살치살 시진만 있네요. ㅎㅅㅎ
세트메뉴가 잘 되어 있어서 좋았고 양도 짱 많고 맛도 좋았어요맵조절 가능하다고 알고 있었는데 말 안해서 조금 매웠지만 덜 맵게로 먹었으면 진짜 맛있었을거 같아요👍,신당동 유정 닭발보다 훨 더 맛있어요~~굿굿~~멀리.갈필요 없오요~~~ㅋ,요즘 순대에 내장을 같이 판매하는 곳이 많지 않은데 여긴 내장도 선택할 수 있어 좋아요통가래떡도 쫄깃하니 맛있고 세트메뉴도 있어 골고루 맛나게 잘 먹었네요
날씨가 조금 선선해진 것 같아서 테라스 이용했습니다 편한 분위기가 좋았고 커피 맛있었습니다,언제나 변함없는 커피맛...넘 좋아요~,너무맛있어요ㅠㅠ 항상 포장해서먹었는데 매장에서 먹어도 좋네요
여름에 우연히 마주하게 된 맛집. 이런 가게가 미사에 있었다니!! 완전 내 취향~• 7시퇴근하고 문닫을까봐 부랴부랴 방문한적도.일주일에 한번씩은 꼭 들러요~,여름에 우연히 마주하게 된 맛집. 이런 가게가 미사에 있었다니!! 완전 내 취향~• 7시퇴근하고 문닫을까봐 부랴부랴 방문한적도.일주일에 한번씩은 꼭 들러요~,고추장먹태 미쳤어요당분간 최애 메뉴입니다ㅠ
넘 맛있어요! 뷰도 넘 예뻐요~😊 가격도 매우 합리적! 강력추천해요~ 파스타 적당히 매콤하고 맛있어요,예전에 알리오올리오 먹고 먹고싶다해서 포장해가는길이에요 😁 로제감튀떡복이도 가격올랐지만 아이가 좋아하고 맛있어서 같이포장해요 매달 5일이면 오일 파스타 반값행사도해서 좋아요 😍👍 까먹어서 한번 이용해봤지만 이번달은 미리 체크했다가 와야겠어요 맛있게 잘먹겠습니다~♥️,가족들과 함께 하남 스톤밸리에서 맛있는 소고기 즐기고 왔어요!  퀄리티는 말할 것도 없고 분위기까지 완벽! ✨ 부드러운 등심에 육즙 팡팡 터지는 그 맛! 아이와 함께 가도 편하게 즐길 수 있어서 가족 외식으로 딱이에요! 👶🧡다음엔 다른 부위도 도전 예정! 😆
역시 처갓집 치킨이네요👍🏻 너무너무 맛있게 먹었습니다 ㅎㅎ 집 근처에 새로 오픈해서 바로 포장해왔는데 사장님이 엄청 친절하시고 매장도 깨끗하고 좋더라고요~ 담에 또 시켜먹겠습니다!! 번창하세욤😊,역시 처갓집 치킨이네요👍🏻 너무너무 맛있게 먹었습니다 ㅎㅎ 집 근처에 새로 오픈해서 바로 포장해왔는데 사장님이 엄청 친절하시고 매장도 깨끗하고 좋더라고요~ 담에 또 시켜먹겠습니다!! 번창하세욤😊,지나갈때 팝콘 냄새🍿가 고소하게 나서 들어갔어요😀오리지널팝콘 소로 주문했는데 가득 가득 담아줍니다. 양이 많아요🤗고소하고 너무 맛있어요.아이가 너무 맛있게 잘먹었습니다🤩매장도 깔끔해서 더 좋았습니다.
알로는 정말 숨은 보석같은 곳이예요! 음식이 하나도 빠짐없이 정말 다 맛있어요! 가격은 합리적이예요! 사장님은 엄청 친절하세요!  나름 까다로운 남편이 여기 알리오올리오를 특히 좋아해요 :)   영업 끝났을줄 알았는데 문 열려있어서  호다닥 들어갔네요~  마감중이셨는데ㅜ 감사합니다ㅜ 오늘도 너무 맛있게잘 먹고가요!  다음에 또 방문하겠습니다 :),너무 친절하게 웃어주시고 반겨주시는 매장입니다 브런치 파니니는 꼭 드셔 보세요 치즈와 고소한 불고기 바싹한 빵의 조화가 일품이였어요^^ 베이컨 파스타 소스랑 루꼴라 너무 맛있어요 싹싹 비우고 왔답니다^^ 커피맛도 진하고 가격 ㅎㄷㄷ 상받으셨다고 했잖아요?  가격 너무 싸서 놀랬어요~~ 담에 근처 종종 미사공원  피트닉 갈때 포장해서 가서 먹어도 진짜 좋을꺼 같아요^^,안심이랑 등심 주문했어요.안심은 부드럽고 담백하고 등심은 식감이 좋고 고소해요.돈까스가 기름 냄새 안나고 바삭해서 좋았어요.양도 많고 푸짐하게 잘 먹었어요. 여기 사장님도 무지 친절하세요.배달은 안하고 포장만 가능한데 포장하는거 보다 거기서 먹는게 더 맛있다고 하시네요. 아이랑 먹기 좋은것 같아요.깔끔해서 좋아요~^^
사장님 두분이서 너무 친절하게 해주셔서 감사하고 맛있고 술도 다양하고 분위기도 좋고 노래도 되게 좋았어요.ㅎㅎ 또 오고싶어요.,음식이 너무 맛있고 노래가 좋아요! 사장님이 너무 친절하셔서 다음에 또 오려구요!!,🙂😋
굿,굿,순대볶음 맛있어요~~~다른것도 맛있을거 같아서다음엔 순대국 먹어봐야겠어요~
ㄱ,ㄱ,사시미 너무 맛있어요 ㅠㅠㅠㅠㅠㅠㅠ 넘 맛있어서 울면서 먹었어요 
특수부위 처음 먹어봤는데 비리지않고 너무 고소하니 맛나게 잘 먹었어요! 야외테라스있어서 바람 맞으며 먹으니 세상 행복 ㅎㅎ 사장님 친절하시고 또 방문하고싶네요! 잘 먹고 갑니다~~ ,맛있어요~~ 곁들여 먹는 양배추가 맛있어서 종종 갑니다 ^^,국물이 찐하고 면이 가늘어서 좋아요그리고 짬뽕에 들어있는 홍합 껍질이 다 까져있어서먹기 편했어요 ㅎ_ㅎ 탕슉은 딱 기본에 충실한 스타일인데 고기가 두툼한 편이고 소스도 맛있었어요b
쭈꾸미랑 멍게 싱싱하고 맛있어요,가리비 사러가는곳이번에는 가격이 많이 올라서 식당서 먹는게 나을뻔ㅜ친절하시고 싱싱하고 좋아요다음부터는 전화해서 물어보고 가야겠어요,맵찔이분들께서는 마라로제 드실때에 꼭 보통맛을 선택하셔야 합니닼ㅋㅋㅋ 저는 맵찔이주제에 패기있게 매운맛 선택했다가 장렬하게 전사하여뜸 ㅋㅋ
도련님은 옛날 같지 않아서 좀 그랬는데 ㅠ 치킨마요가 땡겨서 포장해서 먹었습니다! 역시 치킨마요는 맛있어요🤤,도련님은 옛날 같지 않아서 좀 그랬는데 ㅠ 치킨마요가 땡겨서 포장해서 먹었습니다! 역시 치킨마요는 맛있어요🤤,음식 맛있어요매장에 테이블이 더 많으면 좋겠어요~
#어무이맛 양평 해장국 #어무이맛 양평 해장국 분점#어무이맛 양평 해장국 하남점어무이맛 양평 해장국 양평 본점으로 다니다가 멀어서하남점 이 있길래 다녀왔는데 별로네요 역시 형 만한 아우 없다는 속담처럼 어무이맛 양평 해장국은본점이 역시나 맛있네요 멀어도 양평 본점으로 가야 겠네요 하남점 분점은 뭔가 2% 부족하고 건더기 양도 많이 작고선지도 딱딱 하네요,포장했는데 음료도 주시네요 좋어요,우삼겹덮밥이 낙지덮밥보다 맵더라구요 ㅋㅋ맵찔이 아들이 고군분투하며 먹었어요그래도 맛있었어요 :)
또 가겠습니다!,고기가정말 맛이 있어요,요즘 감기가 걸려서 골골거리다 몸보신하자 싶어 왔는데 몸이 뜨끈해지는게 감기가 다나은거같아요 ㅎㅎㅎ반찬이 우선 가짓수도 엄청많고 맛도 간도 아주 타이트하게 잘 맞네용 (제가 드릴말씀은. .. 합격입니다)아니 추어탕 오랜만에 먹는거 티내는건지 다먹고나서 들깨가루랑 산초 안넣은거 알았네요 ㅠㅠ그만큼 뭐  안넣어도 너무 맛있었어요!!집이랑도 가까워서 담에도 또 추어탕생각나면 방문할거같아요! ㅎㅎ 담에는 추어튀김이랑 추어군만두도 맛보게 정식세트로 먹어봐야겠오요
아이들도 어른들도 다 좋아해서 자주오는데~ 리뷰는 처음이네요~ 늘 먹던 메뉴만 먹는 아이들 ㅎㅎ 어른들은 처음으로 다른 메뉴를 먹어봤는데 다 맛있네요~~!,정말 너무 맛있네요 제 맘속의 3스타 집입니다.일부러 멀리서 먹으러 옵니다. 오늘은 한시간 반 걸려왔네요 가성비 맛 넘버원.. 하남 시민들은 부럽습니다.,상처받을것도 없어요!! 비지니스로 하남미사 왔는데 그냥 숙면은 예의가 아니니 소맥으로 내 목을 달래줄 매장이 어디인가 찾던중! 야키토리(미사)!! 조용하고 시원하게 마시기 좋고 사장님도 친절하시고 맛도 좋았습니다! 마시다 잠든건 죄송합니다!!이건 비밀~~ 그럼 이만~~!!🤣👍👍
배달이빨라요,좋아여,두번째 방문 !! 사장님이 너무 친절하세요 그리고 일단 고기에 자부심이 많으시고 좋은 고기를 주셔서 맛있게 먹었습니다.셀프바도 있어서 좋구요. 일단 음식점은 맛인데 국물도 끝내주고 최고입니다! 많이들 오세욧!
새우패티 만족스러워용! 새우토스트 맛있어요👍 햄치즈 야채는 소스가 좀 달달한 편인거같고요.,사장님도 친절하시고 붕어빵 맛있어요..!!👍,보기완  틀리게  맛있었던 떡뽁이 
좋아요,맛있어요,조용하고 깨끗해요
늘 아는맛,또 재주문합니다.늘 맛나요!,첫방문도 아닌데 올때마다 맛이 특별한 곳!식전빵부터 음식들도 다 너무 맛있다 ㅜㅠ 부채살스테이크 특히 강추...! 특별한 날에도 오지만 아무날 아닐때도 와서 맛있게먹고 리프레쉬하기 좋음~ 맛있어서 싹싹비워버린 그릇~! 강추 재방문의사 10000%🫶🏻
맛집 한 곳 찾았네요~^^연어초밥 너무 맛있고돈카츠도 부드럽고 맛있게 잘 먹었습니다~❤자주 와야 겠어요,자주 시켜먹는 맛집입니다!와서 먹으면 더맛있고요!직원분들 늘친절하셔요~오늘도  갑자기 궁사부 먹고싶다고 해서 급 나왔어요~~저의 호평동 맛집입니당~,역시 미사 국물닭발은서가네 기절닭발이쥬 ㅎ최애맛집.  너무다맛있음...  솔찍히 어떻게 똥집 까지맛있음? 닭발집인데 ㅎㅎ 근데 닭발과..  계란찜을 같이 먹으니 많이 .. 먄
가족 식사 장소로도 너무 좋고 메뉴들이 하나같이 깔끔하고 맛이 너무 좋아서 남녀노소 모두 좋아할 맛집이에요!!수육도 진짜 맛있고 주차장이랑 매장도 엄청 크고 쾌적해서 너무 맛있게 즐기고 갑니당!ㅎㅎ,올림픽공원산책하고 맛집 검색하다가 들리게 된 대동면옥 ! 첫입부터 반해버렸자나여어..💓🥹 그냥 수육 아닙니다 부들부들 입에 넣자마자 사르르 녹는 항정살수육에 칼칼한 비빔막국수는 찰떡궁합이였어요 주문즉시 면을 빼시는지 면도 탱탱하고 육수도 깊은맛나네여 막국수에서 고급진 맛을 느끼기는 또 처음 ㅎㅎㅎ 항정살도 잘못하면 잡내나고 느끼한데 요기수육은 쫀득고소하니 두그릇 먹고 나왔습니다 ㅎㅎㅎㅎ 오픈한지 얼마 안된 신상 감일맛집이라 내부도 너무 깔끔하고 아기의자도 있어서 유아동반손님들도 불편함 없으시겠어요~ 올림픽공원 맛집 찾으신다면 꼭 방문해보세요💓,묵은지김치찜맛있어요다만 고기양이 예전에 비해 줄어든듯 하지만뭐 그래도 맛있게 먹었어요~~
굴라쉬랑 미트로프 시켰습니다. 홈메이드 미트로프인 줄 알았는데 마트에서 파는 패키지로 만드셨더라구요. 엄청 실망스러웠습니다. 정확히 스팸 구운 맛입니다. 이게 진짜 미트로프라고 생각하는 분 없으시길…. 굴라쉬는 엄청 묽고 야채나 고기도 엄청 작아서 이것도 홈메이드는 아닌 느낌이었는데 여쭤보니 직접 만드셨다고 하네요… 아무튼 기대했던 독일 음식이 아니라서 많이 아쉬웠습니다.,감자 스프 ㆍ글라쉬 ㆍ슈니첼 ㆍ훈제연어 플람ㆍ미디엄 소세지 3명이서 먹는데 맛있어서 5인분 먹었어요. 슈니첼은 먹어 본 중 쵝오였어요.재방문 할겁니다.,작고 아늑한 공간에 위치도 좋아서 방문했어요퇴근길에 급으로 방문했다가 너무 맛있게 잘먹어서며칠후에 또 방문했어요 !!!초밥을 혼밥이 처음이었지만 부담없고 너무편하게잘 먹었습니다 ^^  가격도 착하고 무엇보다 맛있어요 ㅎㅎㅎㅎ 단골 찜콩 ~~~ 꼭 방문해보세요~~~ 사장님 두분도 넘 좋으시고 오래오래 계셨으면  좋겠어요 하트하트 !!!!!💓포장보다 방문해서 먹는게 훨씬 맛있네요!!
제주온듯한 느낌의 흑돼지집이네요~돼지고기 질이 좋고 멜젓과 찍어먹으니 맛있어요밑반찬으로 게장이 나와서 좋았습니다. 맛있게 먹고가요~~^^,하남에서 제주 흑돼지를 먹다니 ㅠㅠ 여행 간 기분이였습니다.. 제주 멜젓도 맛있고 ㅠㅠ 사장님께서 직접 구워주시니 편하기까지.. 자주 방문할 듯!!! 단골 예정 맛집입니다ㅋㅋㅋㅋㅋ 고기 부드럽고 쫄깃해서 후회없이 먹고갑니다❤️❤️,고기가 고기가 정말 고기맛이네요 
일끝나고 오랜만에 고기먹으러왔는데 이사해가지고 더 깔끔해지고 넓어졌어여!! 너무 맛있게 잘먹었어용! 여기 진짜  존맛탱에  고기질 진짜 최고입니당! !! 새벽 늦게까지해서  일끝나고 와도 오케이입니다♥︎ 사장님 앞으로도 돈길 부자길 걸으세용>_<,사장님이 친절하고 재미있었어요~고기 질이 좋아서 너무 많이 먹었어요~ㅋㅋㅋ,좋아요 
최애 까페🫶💜💜💜 나타가 우리동네에 있다니 진짜 너무 행운인듯🍀처음 방문했을땐 아기가 50일경이었는데 어느새 130일 정도 된거 같아요ㅎㅎ 그래서 이제는 밤에 가끔 강아지 산책도 가능해요! 강아지랑 남편이랑 같이 산책하면서 나타 커피 마시면 행복은 진짜 멀리있지 않구나 싶네요ㅎㅎ 나타는 강아지도 방문 가능해서 더 좋아요. 저희집개는 말썽쟁이라 사고칠까 무섭긴 했지만…커피 늘 너무 너무 맛있고 사장님도 항상 친절하고 다정하셔서 최고! 새벽수유하느라 졸려서 커피 사가면 한잔은 바로 마시고 한잔은 보관해두고 먹는데 사장님이 얼음없이 밀봉해주셔서 감사했어요. 저는 화요일을 제일 싫어합니다. 나타커피 휴무일이 화요일이거든요ㅠㅠ 그래서 오늘도 이미 두잔 사뒀습니다 ☕️☕️ 후후..오늘도 센스있게 포장해주셔 감사해요 😊,매장 너무 예쁘고 커피와 디저트도 너무 맛있어요!!인테리어 소품 하나하나 사장님 센스도 너무 좋구엄청 친절하셔서 감동..ㅠ🖤분위기 너무 좋아서 혼자와서 책 읽거나 작업하기에도 딱이고 지인들이랑 오면 더 좋은곳!!🍀💗,지난주에 너무 맛있어서 오늘 또 왔어요파전도 추가 ! ! ㅎㅎ 역시 맛있어요 추천추천 !
원래 페리카나 좋아해서 배달 종종 시키는데강아지 산책 겸 호수공원 가서 테라스 자리서 먹어봤는데 엄청 빠삭.. 갑분 인생통닭 탄생했어요ㅠㅠ배달은 따뜻해도 오는 동안 눅눅해지는게 어쩔 수 없나봐요저 이제 배달 못 시켜 먹어요집도 가까운데 걍 와서 먹어야 겠어요 ㅋㅋ ,맛있어요,오소리감투 순대국과 순두부 주문했어요 순두부 고소하고 맛있어요 몽글몽글 하얀 순두부예요 순대국도 맛있어요 그냥 국물도 짭짭 달라붙는 맛이라 좋고다데기 넣어 칼칼하게 먹어도 좋아요 요기 아저씨들 맛집인가봐요 
ㅇㅋ,ㅇㅋ,가격이 너무 올랐네요 조금있으면 2배로 오르겠어요
떡볶이 순대가 너무 땡겨서 집 가는길에 포장했어요~너무너무너무 맛있어요ㅠㅠㅠ,몇번째방문인지모르겟아요 씨언하개 생맥주도있고일단 매운오뎅이 너무 맛잇어요 ㅠㅠㅠ 콩나물이랑 파많이넣어주면 더 좋을거같아요 ㅋ ㅋ 물떡은 처음먹어봤는데 존맛 ㅋ ,굿
동네포차 김치찌개 치킨 세트 먹었는데...김치찌개 얼큰하니 술을 부르네요 동네맛집입니다.,일타포차~~~ 한참전에 가보고 다시갔는데 여전히 사람들도 많고 사장님 친절 짱!!!(여사장님 최고~♡)골뱅이 무침에 사과가 채썰어 들어가 새콤달콤하게 맛있어요. 치킨도 간장맛과 오리지널 다 맛나는데 전 갠적으로 간장맛이 더 좋아요 하이볼도 후레쉬하게 맛나는데 또 생각날듯~^^사진에 없는 오뎅탕도 은근 얼큰해서 좋아요 근위튀김 또한 맛났어요 그래서 또 만남장소로 가게 될듯한 기분좋은 시간이 되었네요맛집 인정합니당~~~~~,처음방문했는데 완전 반하고 왔어요음식이며 분위기며 손님도 외국분들도 계셔서  해외분위기도 나고가족외식 제대로 하고왔네요파스타랑 스테이크 존맛탱 입니다앞으로 지인모임은 여기서 하는걸로^^
너무 만족스러운 식사였어요! 사장님과 아드님 모두 너무 친절하셨고 매운탕은 잡내도 하나도 안났습니다. 메기도 살이 통통하고 국물이 진해서 맛있었습니다. 서비스+맛 모두 만족스러워서 기분좋은 식사했어요! 숨은 매운탕 맛집입니다!!! ,너무 만족스러운 식사였어요! 사장님과 아드님 모두 너무 친절하셨고 매운탕은 잡내도 하나도 안났습니다. 메기도 살이 통통하고 국물이 진해서 맛있었습니다. 서비스+맛 모두 만족스러워서 기분좋은 식사했어요! 숨은 매운탕 맛집입니다!!! ,늘 항상 손님이 많아 궁금했던 라홍방 마라탕✨️✨️오늘도 역시나 손님이 많더라구요>_<첫 방문이었는데 너무너무 맛있게 먹고 왔어요!!꿔바로우도 너무 쫀득하고 바삭하고... 진짜 미사 마라탕집 중에 제일 맛있는 것 같아요💕💕손님이 많은데 이유가 있네요 🤭담에 또 올게요~~
생일 기념으로 데이트겸 검색해서 찾은곳예약 후 방문하니까 기다릴필요도 없고 신선한 음식이 준비되어있으며 불쇼 등 퍼포먼스도 겸비한 젠가든사장님께서 음식 너무 맛있게 준비해주셔서 입과 눈이 즐거운 저녁한끼를 먹을 수 있었습니다,만족스러운 식사였습니다.친절하시고 퍼포먼스도 멋지구요ㅎ다음에 재방문 의사 있습니다.주차공간이 애매한게 조금 아쉬운부분 이구요아이들도 있어서 1인코스 다 포함인 줄 알고 살짝 부담됐는데꼭 인원수대로 하지않아도 되고 고기추가.랍스터추가 이런식으로  양이 부족할 시 추가하면 되고 드시면서 결정하셔도 된다고 말씀해주셔서 너무 좋았습니다^^,덕소에서 찾아가는 죽이야기 진짜 맛집입니다~지난달 근처에 갔다가 우연히 들러 지인과 바다치즈죽을 먹었은데  맛본 후 계속 생각이 나더라구요. 칵테일 새우와 갖은 야채 그리고 걸쭉한 치즈가 듬뿍~ 너무 고소하고 맛있어서 또 먹으러 갔어요. 그릇이 넘치도록 가득 주시는 젊은 부부 사장님께서 바쁘신 와중에도 반찬 모자라는것 없는지 물으시며 저희아이에게 음료수 서비스까지 너무 감사했어요. 사진은 못찍었지만 이날 가족들이 시켜먹은 김치낙지죽 완도전복죽 게사날치알죽도 다 너무 맛있었어요~ 그 날도  한우야채죽과 삼선짬봉죽을 또 포장해왔는데요 무엇보다 작은용기에 나눠먹을수있게 포장해주시니 너무 좋더라구요~ 무더운여름 건강과 맛 다 챙길수있는 이곳 죽이야기 강추입니다!다음에 가면 밥 종류도 먹어보려구요ㅎㅎ
와플이 맛잇네요~~,와플이 맛잇네요~~,비오는날리드미컬한 음악과 포케 어떨까요?전 좋았어요 기분전환도 되고 건강해지는 느낌
매장이 어수선합니다.식사하는데 주방이모인지 여자사장님이신지너무 시끄럽게 떠들어서 거슬리네요최소한 손님이 있으면 신경좀쓰세요김밥 말고있는데 김밥에 침 다들어가겠네,좋아요,푸짐하고 양도 많고 맛이 있는 잡채밥 짬뽕 국물 서비스까지 즐기고 갑니다
너무 좋아하는 포케집이라 송리단길점 자주갔는데 미사에 생겨서 너무 좋아요! 어제 왔는데 오늘은 부모님 모시고 또 왔네요☺️건강한데 맛있어서 자주 오려구요!🥰모두 맛있게 드시고 건강하세요❣️,항상 회사근처에서 먹던 메뉴로 먹었는데미사 지점도 새로생겨서 와봤어요포케 체인점중에선슬로우켈리가 제일 맛있는것 같아요새가게라서 그런지 재료도 신선하고가게도 깨끗하네요 굿굿 혼밥하기에여기만한곳이 없쥬,가격이 너무 말도 안되는데 메뉴들도 하나같이 면도 맛나고 치즈며 재료들도 모자람없이 풍족하게 나옵니다 여러모로 감동 받았어요 가족단위 학생들 너무 먹기 좋을거 같아요~ 투움바파스타 넘 맛있었고요 해물토마토파스타도 해물이 많아 맛났습니다 이렇게 피자까지 먹어도 26400원이랍니다 놀랍죠?? 가성비 최고!!!👍
너무 맛있게 먹었어요!! 분위기도 최공^^ㅎㅎ,오랜만에 혹은 좋은사람과 대화할일이 있을때 항상 오는 청담이상~,달수네꾸지뽕 닭곰탕  최고👍닭살이 잘발라져있고 양이 진짜 많아요점심에 7천원으로 아주 배부르고 맛있게 먹을수있어서 좋아요
멕쓰치킨~~!!!치킨 주문과 동시에 튀겨주셔서 그런지 느끼하지 않고 너무 담백해요 생맥주도 맛있고 망월동 하이볼도 달달하니 너~~무 맛있어요~~^^치맥하기 좋은곳이라 앞으로 단골될것 같아요~~자주 올게요~~^^ ,매운간장치킨이 사장님이 직접 만드신 것 같은 소스가 같이 나오는데 무척 뜨겁고 맵고 맛있어요! 기름 관리가 철저하신거 같아요. 튀김이 바삭하고 색이 맑네요!,노부부와 아들이 함께 운영하는 곳으로 너~~무 친절하세요^^민물매운탕 좋아하는데 멀리 북한강 남한강변까지 갈 필요없어요냄새 전혀 없고 직접 담그신 장으로 양념해서 자극적이지 않고 구수하니 시원해서 맛나요메기도 항상 실하고 먹고나면 몸보신되는듯 해요
팥빙수 맛있어요,팥빙수 맛있어요,지난주에 오고 또 왔어요 너무 너무 맛있어요다음 주에도 또 오고 싶은 맛이에요
정말 맛있습니다.  하우스와인도 같이 잘 어울리네요,주차가 너무 힘들어 초대한분들에게 미안했어요근처.유료주차장도 좁고 불편했어요피자와 라자냐도 맛있고 문어도 부드럽고 맛있었어요좀 더 편한 사람들과 와인먹으러 오고 싶네요,너무 맛있게 먹었어요!! 분위기도 최공^^ㅎㅎ
육회가 넘 맛있읍니다,육회가 넘 맛있읍니다,좋아요
미사에서 양갈비로 가장 유명한 미사 에헴 양식당에서 즐거운 시간을 보냈어요~매장 분위기도 아주 고급스럽고 좋답니다저희가 먹은 일본식 샤브샤브인 스키야키도 맛이 최고입니다고기도 신선하고 마직막에 나오는 우동도 완전 별미!!재방문 의사 100%입니다~^^,소고기 스키야키 ! 먹으러 왔능데 뷰도 좋고 ㅜ 음식도 진짜 맛나요 우아 ⭐️⭐️ 부니기가 넘나 조아버려서 ㅋ 데이뚜 느낌 랑랑 하네요 ❤️관서식 스키야키 첨 먹어봤는데 국물 자작하게 먹으니 진짜 꾸르맛 ! 서비수 우동까지 갓성비 혜자입니다ㅠ 또 또 또 올집 👍👍,도란도란 참 맛있어요. 동료도 맛있다고 하고요
맛있고 차분하게 한끼먹기 좋아요,길동우동이 우동만 맛있는게 절대 아니예요!!!! 국수가 정말 정말 맛있는 맛집입니다!!! 비빔국수 완전 추천드려요. 입맛 없는 날 비빔국수에 갈비 만두면 세상 행복해요. 센스있게 미니돈까스도 3500원에 판매하셔서 얼른 주문하고 국수랑 양 딱 적당하게 잘 먹고 왔어요. 담에 뭐 먹을지 미리 생각하고 왔다죠!!~>_< 길동우동 비빔국수 짱짱짱♡ ,😃
