🙂,🙂,맛있어요 
돌문어-부드러운  문어와 바닥엔  크리미한 허머스 위엔 튀긴 감자채가 있어서 다양한 식감을 즐길 수 있어요.보리 리조또- 보리로 만든 리조또는 처음 먹었는데 익힌 버섯뿐 아니라 버섯칩을 위에 올려줘서 정성 듬뿍 들어간 메뉴였어요.제노베제 파스타- 양파를 아주 아주 많이 넣은 파스타라는데 양파가 많이 들어가서 그런지 달콤한 맛이었고요. 부채살 스테이크는 숯향이 느껴지고 잘 구운 스테이크였어요. 너무 맛있어서 하나 더  주문^^생일이라고 하면서 주문한 디저트 접시에 초랑 초콜렛 글씨도 감사했어요. 셋이서 음식 나오는  대로 다 비우고 왔어요. 집근처에 맛집 하나 발견했네요.,미사역 근처 분위기 좋은 와인바 찾으신다면 키치플레이트 추천드립니당 ♥ 제노베제 파스타랑 한우 비프 타르타르 주문했어요!! 파스타도 맛있지만 비프 타르타르 넘 맛있어요 위스키나 와인 주류 다양하게 판매하고 있어 취향에 맞게 고르시면 좋을 것 같아용 ㅎㅎ,맛있어요사장님 친절해요
조개구이 먹고 싶다고 해서 갔어요!ㅋㅋㅋ 양 엄청 많아 보였는데 생각보다 먹을만했어요 물론 배터졌지만😇 구성 다양하고 3분이면 호로록 익고 계란찜 맛있고 아무튼 다 좋았어요 술 잘 안먹는데 소맥 바로 시켜버렸둡니당,날씨도 선선하고 해산물사랑이라 처음방문인데양도 푸짐하고 좋네요!친절하시고 잘먹었습니다 ^%,엄청 검색해서 찾은 맛집이예요육즙 가득 깔끔한 수육 이게 무슨 일인고?너무 부드럽고 살살 녹는 맛수육 맛집 맛고요. 간재미에 미나리 얹어 먹는데 참 맛있어요.회냉면도 간재미회 듬뿍 얹어서 간장베이스 짭쪼롬한 육수 한컵 부어먹으니 자작자작 맛있는 육즙회냉면이 되었습니다.배불리 맛있게 잘 먹었습니다.가격 착하고 주차 편하고내부 인테리어 깨끗하고직원분께서 참 친절하시네요.다음에 또 올께요~
자전거 설명부터! 맛있는 음료까지 공간과 자전거 모두가 완벽한 곳이었습니다. 자주 오도록 열심히 라이딩 해야겠네요! 감사합니다. 👏🏻🚴‍♂️,매장이 넓고 자전거 관련 용품들도 많아요.음료값은 비싸네요 ㅠㅠ,안주 하나하나 너무 맛있어요~특히 토마토스지나베! 이거 장난없습니다!어느정도 먹고나서 파스타면 추가하면크..👍👍👍 끝내줍니다~마지막으로 치킨가라아게!! 요고 웬만한 치킨집보다 맛납니다~ 사장님 솜씨가 좋아서 다른메뉴들도 맛 좋으니 꼭 방문해보세요!!! 강추!!!-ㅍㅈ
🙂😋,비오니까  분위기 너무 좋아요. 밑반찬이랑 닭볶음탕 맛있어요  쉰 총각김치는 제 스타일이아니였어요~^^,오랜만에 곱창을 진짜 맛있게 먹었어요!!! 곱도 진짜 많이들어있고 우삼겹이랑 염통 대창까지 골고루 들어있어요~! 저희는 곱창 모듬을 시켰는데 들어오시는 손님분들중에 냉면 시키시는 분이 왤케 많은건가요...!!! 여기 냉면도 잘하나봐요 다음에는 냉면 먹으러 갈거에요!! 기대만땅!! 밥이랑 국도 무제한이라니 이렇게 다 퍼줘도 되나 싶은 마음도 들었습니다...ㅋㅋㅋᩚ 인심좋은 사장님이신가봐요~ 기본반찬도 다 맛있는데 저는 부추무침? 그게 제일 맛있어서 한줄기도 남김없이 다먹었어요!! 풍산쪽 가게되면 냉면먹으러 꼭 갈거에요🤩
사장님이 너무 좋으세요 :) 큰홀은 아니지만 아이랑 먹었구요 !! 아이가 과자 좋아해서 혼자 끌어 안고 먹으니 사장님이 리필도 해주시고 갈때 봉투에 좀 싸주셔서 너무 감사했어요 !,단골 고객입니다 치킨 정말좋구요 특히 사장님 사모님 늘 미소가득하시고 정말 친절하세요 평소 홀에서 자주 먹지만 오늘은 포장해먹으며 리뷰남겨요 이런 왕친절가게는 엄청 잘 됬으면 좋겟어요 오늘도 잘 먹었습니다^^ ,늘 맛있네요~~^^
친절하고음식도 푸짐하게 주시는동네맛집입니다!,언제 먹어도 맛있어요,오랜만에가도 변함없이 맛있습니다하남에서 젤 맛있는 피자와 파스타집!
진짜 청국장전문점보다 청국장이 더더더 맛있는곳이에요냉삼도 도톰하니 잡내없이 맛있고사장님 너무너무 친절하세요점심에 열무비빔밥도 먹으러 가보고싶어요👍,진짜 청국장전문점보다 청국장이 더더더 맛있는곳이에요냉삼도 도톰하니 잡내없이 맛있고사장님 너무너무 친절하세요점심에 열무비빔밥도 먹으러 가보고싶어요👍,좋아요
,바다의 맛이 느껴지는 맑고 깔끔한 가리비 해장국은 콩나물과 가리비가 들어 있어서 그런지 시원하고 개운해서 먹고 나니 피곤함이 싹 없어지는것 같았어요고등어구이와 황태구이도 좋았지만 저의 원픽은 가리비해장국이였어요,부대짜글이 맛있어요~~ 계란말이도 엄청커요...!! 집근처에 있고 늦게까지해서 좋아요 다음엔 다른메뉴도 먹어볼게요~~👍👍
정말 오래되고 맛있는 국밥집하남의 맛집중 한곳으로 외부손님 방문시 식사대접하는 식당중 한곳으로친절하고 건강하게 식사하기 너무 좋습니다~,비오늘날 뜨끈뜨끈한 한우국밥 한그릇 뚜딱 근데 땀이 주르륵ㅋㅋ 한여름에는 조금 피해서 먹어야겠음 일단 맛있어서 ㄱㄱ 재방문 백퍼욤,육사시미 엄청 신선하고 최고에요!합리적인 가격대에 이정도 퀄리티라니 늘 주문해서 먹을 때 마다 감탄합니다...👏👏👏정말 만족스러운 저녁이였어요 또 주문할게요😛
막회 대 입니다처음 왔는데 너무 맛있고 양도 많아요 매운탕도 맛있어요!,회가 신선해요,굿
짱맛 세가지 메뉴 각각 다 맛나용 와 특히 고구마튀김👍🏼👍🏼👍🏼,친절하고맛있어요,가족여행 가면서 아이들은 햄맛살 어른은 김치참치랑 참치 먹었는데 다 맛이써요어찌나 뚱뚱한 김밥인지 인심 진짜 후하셔요서비스로 초콜렛도 넣어주시고 감사합니다 사진은 햄맛살이고. 다른건 차안에서 허겁지겁 먹느라 못찍었네요.우엉이 넘쳐흘러요ㅋㅋ대량으로 공장에서 만드는 찐득한 우엉 아니고 아삭거리고 담백한 ..직접 조리 하신게 느껴집니다김밥은 무조건 여기입니다~~^^
들깨마을 맷돌순두부 하남미사점~~저희는 2인 고등어구이 한상차림 주문했어요~~해물순두부는 정말 매콤하고 시원한 해물베이스~!!곱창순두부 정말 담백하고 속이 든든한 고기 베이스~!!!다른 순두부 맛집에 비해서도 정말 훌륭해요너무 맛있고 양도 많고사장님들도 친절하시네요~~까다로운 남편도 맛 100프로 맛있다네요^^종종 순두부 먹으러 오겠습니다^^,부대순두부 맛있게 잘 먹었어요😄,좋아요
와..주문한 메뉴 모두 너무너무 맛있어서 놀랐어요!!🫢모든 메뉴를 다 직접 만들어 주시는데 심지어 기본 안주인 새우알칩까지 매일매일 튀기시는 거더라구요😍 생맥주는 물론 하이볼에 칵테일에...주류도 다양해요👏🏻👏🏻👏🏻 완전 추천합니다!!❣️,가성비 갑 찾았습니다..저 안주빨 엄청 세우는 사람이라친구들이랑 술집가면 욕 엄청 먹는데..여기 안주가 정말 저렴해요!저렴해서 퀄리티가 떨어지는 건 아닐까 걱정했는데놉 전혀 절대 아니에요매장 분위기도 너무 좋고술도 다양해서 더욱 좋았던 곳이에요!직원분들도 너무 친절하시고개인적으로 에그인헬 진짜 너무 맛있게 먹고왔어요!소중한 추억 만들게 해주셔서 진심으로 감사합니다💚,정말맛있어요 고기가 숯불향가득 너무부드러움!!! 스타필드점이 명륜진사찐맛집  !곤드레나물밥도 생겼네요
속전속결 빠르고 맛도 있고 최고네요,좀 비껴가긴 했지만 복날 보신을 위해 장어 덮밥을 주문했어요! 곁들이로 계란도 있어서 맛있게 잘 먹었습니다,너무 맛있어요
맛있게 잘 먹었어요.양이 조금 작은듯 하지만 가격이 워낙 착해서 한개 더 주문해서 먹음 딱이에요~ 아이가 너무 잘 먹어요.주문한 메뉴 다 맛있어요~👍,맛있게 잘 먹었어요.양이 조금 작은듯 하지만 가격이 워낙 착해서 한개 더 주문해서 먹음 딱이에요~ 아이가 너무 잘 먹어요.주문한 메뉴 다 맛있어요~👍,돼지고기 잡내는 없는편이고 국물맛은 진~~해요.고기도 두껍고 갯수도 많아서 가격대비 매우 만족합니다.
감일동 돌아다니다가 고깃집 새로 생겼다해서 왔는데 정말 맛있는 고깃집 찾은 것 같네요 강동구 사는데 감일동까지 찾아와서 먹을 정도로 정말 맛있는 것 같아요 그리고 잘라서 초벌시켜 나와서 고기도 거의 안구워도 되고 불 조절도 하기 쉬워서 정말 편리한 것 같네요 맛있게 잘 먹고 갑니다 자주 올게요 단골 예약이요 !!,감일동 돌아다니다가 고깃집 새로 생겼다해서 왔는데 정말 맛있는 고깃집 찾은 것 같네요 강동구 사는데 감일동까지 찾아와서 먹을 정도로 정말 맛있는 것 같아요 그리고 잘라서 초벌시켜 나와서 고기도 거의 안구워도 되고 불 조절도 하기 쉬워서 정말 편리한 것 같네요 맛있게 잘 먹고 갑니다 자주 올게요 단골 예약이요 !!,항상 와보고 싶었는데 기회가 되서 드디어 와봤어요 기대했던만큼 맛있네요 창가에 앉으면 호수공원 뷰도 볼 수 있어서 더 좋았던 것 같아요 친구나 연인과 도란도란 대화를 나누기 좋은 장소인 것 같아요!
가벼운 마음으로 갔다가 소주 세병은 뿌시게되는 하남시청 횟집이에요 스끼다시가 잘나와서 좋았고 회도 신선했어요! 해물라면도 9천원인데 엄청 푸짐하게 나와서 좋았고 다른 안주들도 맛있었어요☺️,가벼운 마음으로 갔다가 소주 세병은 뿌시게되는 하남시청 횟집이에요 스끼다시가 잘나와서 좋았고 회도 신선했어요! 해물라면도 9천원인데 엄청 푸짐하게 나와서 좋았고 다른 안주들도 맛있었어요☺️,ㅇㅇ
신선하고 맛있어요! 연어랑 닭가슴살도 든든했고 견과류도 병아리콩 아몬드등 다양하게 들어있습니다. 오리엔탈소스가 깔끔하니 좋았습니다. 집근처에 샐러드가게가 생겨서 가볍게 먹을겸 포장했는데 만족스럽네요ㅋㅋ 종종 사먹게 될꺼 같아요~,신선하고 맛있어요! 연어랑 닭가슴살도 든든했고 견과류도 병아리콩 아몬드등 다양하게 들어있습니다. 오리엔탈소스가 깔끔하니 좋았습니다. 집근처에 샐러드가게가 생겨서 가볍게 먹을겸 포장했는데 만족스럽네요ㅋㅋ 종종 사먹게 될꺼 같아요~,가격은 저렴한데 기름이 너무 많아요.
가끔 가는곳인데 갈때마다 대만족고기맛있게 구어줘서 최고맛도좋고 친절하고 깨끗함 최고 사이드메뉴와 셀프바 최고,우리가족이 제일 좋아하는 우리동네 최고 맛집이에요일단 여기가 제주인지 미사인지 모를정도로 초록초록 예쁜 인테리어와 기본으로 나오는 김치찌개에이미 밥 한공기 뚝딱이구요 (애들도 잘먹어요)냄새부터 예술인 특삼겹살은 말모 그냥 👍거기에 고사리 떡 김치랑 같이 구워 잡수면둘이먹다 셋이 죽어도 모를 맛이에요 마무리는 양은메밀냉국수 로 우리 4인가족시원하게 마무으리 합니다!! 오늘도 참 잘 먹었습니다~ 사장님 💙,재료 신선하고 넘 담백하고 맛있어욤 ~ 
집앞인데 가보자가보자햇지만늘 가던곳만 가는 제게 쉽지않앗던그런데 신랑이 오늘은 여기를 가보자하기에 따라갓습니다 맛있더라구요 ~^^집앞 고기맛집 찾앗네요 고기도 구워주시니 좋아요,친절,엄청 깔끔하고 곱창집 테이블 이정도이면 위생갑입니다위생은 물론 곱창이 맛있어요~티비에 나오는 맛집곱창보다 더 맛있음~저번에 곱창구이 먹었는데 오늘 일부러 곱창전골 시켜먹었는데 이것도 맛은 엄청 괜찮네요~~
8000원에 점심 먹기 정말 좋아요,점심은 늘 독상이지만이 식당에선 편안히 잘 먹어요8000원으로~,쭈꾸미가 엄청 신선하고 부드럽고 양념이 너무 맛있어요~
사장님!! 옛날 불야성 그맛 그대로여서 감사합니다!♡ 기본안주로 전복이라니요~~ 역시 최고에용^^ 조개찜은 말할것도없구ㅠ  사장님 사모님 건강하세요~,일단 맛을 떠나 양이 너무 적어요처음에 전복회 1미가 나와 시작은 좋았는데 그게 다였습니다.조개찜 먹었는데 미사 상일동 수산시장 여러곳에서 먹어봤는데 가장 양이 적고 부족합니다 반찬도 셀프서비스 적어 놓으셨는데셀프 이용불가입니다.저는 재방문 의사 없습니다. 조개찜은 다른곳으로 갈께요.,자박도리탕 맛있다는 지인추천으로 먹어봤는데 맛있어용 늦게까지 해서 그게더 좋아요ㅎㅎ
굿,굿,커피가 진하고 맛있어요조각케이크도 종류가 다양해서 좋아요
역시 신전은 떡볶이에 오뎅튀김임👍,떡볶이 먹고 싶을때 항상 이용합니다정말 맛있어요!!!,리뷰가 좋아서 첫 방문했어요♥️ 먹어보니 왜 리뷰가 좋은지 알겠더라구요! 일단 고기질이 대박입니다🙆🏻‍♀️ 부위별로 맛도 다른데 다 맛있어요. 배부른데 1인분 더 먹어야하나 고민했습니다😌 그리고 밑반찬으로 나오는 무생채나 장아지3종 등등 다 맛있어요! 보통 가짓수 채우려고 맛없는반찬들 올려놓는곳들도 많은데 여긴 밑반찬도 맛있네요:) 주차도 가능하고 우리집 댕댕이와 올수있어서 자주 방문할거같아요😎 일단 고기맛이!!! 최고👍🏻
감일동 이근처에 새로생긴 삼겹살집중에 고민하다 여기로 왔는데 너무 잘한거같아요. 오겹살 된장술밥 좋아해서 시켰는데 일단 고기도 너무 맛있고 둘다 너무 맛있었어요! 고기도 맛있게 구워주셔서 자주 올거같아요,지나가다 사람이 많길래 들어와서 먹어보니 너무너무 맛있어요 고기두 구워주시고 친절하세요~,자리없을까봐 예약하고 갔는데 역시나 사람이 많았어요.오도독구이랑 껍데기 맛있고 라면이랑 같이나오는 김치도 짱맛!!!사진은 없지만 비빔국수도 강추에요~~
양념이 너무 맛나요 콩나물이랑 같이 비벼먹으면 아삭한 식감+양념맛 즐길 수 있어요물론 코다리도 맛있어요,양념이 너무 맛나요 콩나물이랑 같이 비벼먹으면 아삭한 식감+양념맛 즐길 수 있어요물론 코다리도 맛있어요,가격도 착하고 매장도 분위기가 차분해서 너무 좋아요!! 가볍게 샐러드랑 샌드위치 먹기 좋은 맛집 카페다예 자주 올게요~~!!
고기가정말 맛이 있어요,또 가겠습니다!,친절하고 맛있어염~
굿,굿,괜춘해요~~조금 고기냄새가 나지만..먹을만합니다..ㅎㅎ
가족들과 외식하려고 방문했던 곳입니다.집근처여서 주의깊게 보고 있었는데 아주 만족했습니다.가게가 깨끗하고 매우 친절하며 음식의 맛이 깔끔합니다.오래된 역사를 가진 곳이라고 들었는데 그 명성에 걸맞네요~ 가게도 매우 커서 가족모임이나 회식에 적합해보입니다.곧 추워지는 겨울이 다가오는데 메뉴도 아주 잘 어울리는 메뉴들로 구성되어 있습니다. 후회없을 방문 이었습니다~,올림픽공원산책하고 맛집 검색하다가 들리게 된 대동면옥 ! 첫입부터 반해버렸자나여어..💓🥹 그냥 수육 아닙니다 부들부들 입에 넣자마자 사르르 녹는 항정살수육에 칼칼한 비빔막국수는 찰떡궁합이였어요 주문즉시 면을 빼시는지 면도 탱탱하고 육수도 깊은맛나네여 막국수에서 고급진 맛을 느끼기는 또 처음 ㅎㅎㅎ 항정살도 잘못하면 잡내나고 느끼한데 요기수육은 쫀득고소하니 두그릇 먹고 나왔습니다 ㅎㅎㅎㅎ 오픈한지 얼마 안된 신상 감일맛집이라 내부도 너무 깔끔하고 아기의자도 있어서 유아동반손님들도 불편함 없으시겠어요~ 올림픽공원 맛집 찾으신다면 꼭 방문해보세요💓,하타네 미사점에 다녀왔어요 요즘 일본어로만 된 일본스타일 주점 이자카야가 유행인데 미사 문화거리 초입에 하타네! 일본어이지만 한국어인 센스있는 간판! 일본여행 자주 다니는데 일본의 거리에서 만날법한 이자카야입니다. 오늘 크빠새와 닭날개튀김 가라야게폭탄먹었는데 단연 닭날개튀김 강추예요 맥주안주 대박! 크빠새는 치즈멜팅에 빠진 짭조롬한 새루를 빵에싸서 먹어도되고 그냥먹어도 되는데 타코야키 철판에 올려주어 이색적인 안주였어요! 가라야게도 꽤 고퀄 안주! 가격대와 내부가 혼술로도 너무 괜찮고 일본음악이 흥겨워서 단체모임도 괜찮을 것 같더라구요! 맥주한잔하는데 너무 시원하고 맛있어서 더위를 싹 날리는 기분! 하남미사 이자카야 맥주한잔 술집찾으신다면 꼭 한번 방문해보세요! 또 갈게요!!
n 번째 방문이에요!너무 맛있어서 사진찍는것도 깜빡했어요ㅋ삼겹살 먹고싶을땐 무조건 여기옵니다~,n 번째 방문이에요!너무 맛있어서 사진찍는것도 깜빡했어요ㅋ삼겹살 먹고싶을땐 무조건 여기옵니다~,사장님 친절하시고 쾌적한 분위기에 창밖 보이는 풍경이 편안해서 쉬기 좋았어요😌다만 커피와 디저트 맛은 좀 아쉬웠는데 따뜻한 라떼는 고소한 원두를 선택했는데 우유 쓴맛과 거품이 많아서 아쉬웠고디저트도 무난한 편이였어요  🥲
좋아요 좋아요,음식이 빨리 나오고 양념이 너무 맛있어요!밥 비벼서 계속 먹고 싶은 맛!ㅎㅎ지역화페(하머니)도 가능해서 좋아요!·ᴗ·,음식도 빨리 나오고 뜨겁고 맛있어요
깔끔합니다.,굿,푸짐한 양 친절하신 사장님👍🏻👍🏻진짜 꾸덕하고 맛나요!! ㅎ.ㅎ
동네에 이런 치킨맛집이 있었네여;;;완전 깔끔하고 맛있어요.,친구들이랑 즐건시간 보내고가요~,인테리어부터 너무 맘에들어요뭣보다 집앞이라 젤맘에들고맛은 뭐 말뭐(--)(__)??진짜 신선하고 맛있어요나중에 또 갈거에요:)힛
술고래 창고..술 종류도 많고 할인 품목도 많아요.빈병도 받아주세요.,늘 가는 곳맥주 라인업이 계속 바뀌는게 맘에 쏙 든다,너무 맛있고 친절해요 다른지점보다 맛있는거같아요
라멘가츠동교자가리아게 주문해서 먹었어요.가츠동 나오고 라멘은 나오자마자 먹어서 사진이 없내요~~일본에서 먹었던 라멘 생각나서 먹었는데 더 맛있내요.아이들도 맛있다고 잘먹었어요.또 올게요. 감사합니다.,언제와도 맛있는 솔라멘~~ 이집만의 라멘 국물이 이집만의 맛이 있어서 자꾸 찾아오게 됩니당 오늘은 가라아게도 같이 시켰는데 전에 먹었을때보다 더 맛있게 느껴졌어요!,아담하고 분위기 좋은 맥주집안주 맛있고주인 내외분 너무 친절하심또 갈집
혼밥하기도 좋고 메뉴도 다양해서 이것저것 맛보기 좋아요,반은 먹고 반은 가지고갈수있냐고 여쭈니 아주 친절하시게 그리 해주셨어요 식구도 콩국수 맛있게 잘먹었어요 부득이하게 다른식구가 분식먹고싶어서 포장했는데 흔쾌히 허락해주셨어요 음식도 맛있네요 종종올게요 대박나셔요~😄👏🏻💕,여기 처갓집 진짜 맛있어요!! 가끔 슈프림양념치킨이 땡길때 먹습니다 ㅎㅎ  사장님도 친절하시고 여기지점은 튀김이 바삭하고 살도 퍽퍽하지 않아서 항상 맛있게 먹습니다 더 잘되었으면 좋겠어요 !!!
감일동 돌아다니다가 고깃집 새로 생겼다해서 왔는데 정말 맛있는 고깃집 찾은 것 같네요 강동구 사는데 감일동까지 찾아와서 먹을 정도로 정말 맛있는 것 같아요 그리고 잘라서 초벌시켜 나와서 고기도 거의 안구워도 되고 불 조절도 하기 쉬워서 정말 편리한 것 같네요 맛있게 잘 먹고 갑니다 자주 올게요 단골 예약이요 !!,넓고. 한적해서 편안하게식사했네요..초벌 삽겹살 맛났네요,삼겹살도 맛있는데 닭갈비도 역시 최고네요~ 닭갈비 고기도 육즙이 살아있고 양념이랑 참나물에 양배추 각종 야채들과 넘 조화로운 맛이예요~ 오늘은 치즈닭갈비 먹었는데 치즈에 찍어서 직접 담그시는 무쌈이랑 깻잎에 상추 싸서 먹으니 늠 행복하더라구요~ 정말 자꾸 생각나는 맛집입니다~강추강추!!!!!!
굿,굿~,하남에 지호한방삼계탕이 몇개있는데..저는 집에서 제일 멀지만 미사로 꼭 옵니다‼️‼️ 반찬 셀프코너도 생겨서 더 좋습니다👍👍
분위기 좋아요,가성비 좋아요가격이 저렴하네요안주가 아기자기해요,맛집 발견! 감자탕 먹고싶은날엔 여기로 올거에요. 푸짐한 뼈다귀. 잘익은 묵은지. 쫄깃한 수제비를 곁들이니 정말 맛있네요. 게다가 연노랑 모자쓰신 사장님의 친절은 맛있는 음식의 맛을 열배 더 맛나게 해주시네요.  이렇게 밝은 모습으로 서빙해주시는 모습을 보면 기분도 좋아지고 다시 오고싶은 마음이 꼭 생기더라고요. 강추  한표요!!!
포장해왔어요 상추랑 무김치주셔서 좋네요!맛도 좋고 양도 꽤되네요 그리고 친절하세요매장 내부에서도 식사가능하고 살코기 좋아하는 분들도 좋아할것같아요! 맛집 찾은것같아 기뻐요ㅋㅋㅋ자주갈게요~,꼭 여기서 드셔보세요이런가게는 처음이였어요손님한테. 직접 술가져다먹으라하고춥다는데 주인은 덥다고 에어컨틀고 옆에 손님도 짜증내고주인은 앉아서 가만있고정말좋았어요오래오래 장사했으면 좋겠어요세상 놀라서 리뷰처음다네요도가지나치게좋아요,방문시간까지 이야기했는데 미리 만들어놓고 막상 방문하니 자리 비워 십분이상 기다리다 가 식은 치킨을 받아왔네요. 실망입니다. 
중식당 맛있고 좋아요 친절하세요 추천합니다,👍🏻👍🏻,홍진 스탬프 투어하려는 목적으로 처음 방문했습니다.그냥 카페인 줄 알았는데 자전거&용품 샵 겸 카페였네요..매장을 고급스럽게 깔끔하게 꾸며 놓았어요..홍진  헬맷 카스크 헬맷 많이 있고 온라인에서만 봤던 라메다 시착 및 구입 가능한 매장입니다.은근 볼거리 있어요..스탬프 투어 덕에 처음 방문했는데 앞으론 종종 방문할 듯 합니다.아참.. 바닐라빈 라떼 마셨는데 맛있었어요!쿠키도 다양하게 판매합니다.
매장 완전 깔끔하고 친절하세요 ㅎㅎ,도너츠가 맛있어요! 직원분도 짱 친절!!,새로옮긴 매장이 아주넓고 좋습니다ㅎㅎ   셀프바로바뀌고 더좋아졌어요 ㅎㅎ볶음밥 셀프로할수있어요
그럭저럭 먹기엔 괜찮아요,게다리된장찌게는 반조리 상품이고요.포장 뜯어서 그냥 끓이면 되더라고요.게다리는 딱 한개 들어있었습니다. ㅋ,잡내없는 찐국!!! 이런집 드물거 같습니다.
사시미 너무 맛있어요 ㅠㅠㅠㅠㅠㅠㅠ 넘 맛있어서 울면서 먹었어요 ,양이 어마무시하네요 고기 질도 너무 좋구요저 노란소스랑 육회가 너무 잘 어울려요 앞으로 자주 시켜 먹을거 같아요!맛있게 잘 먹었습니다😋,굿
신랑 생일이라 큰 마음 먹고 다녀왔어요! 신랑이 회도 스시도 너무 좋아하거든요~ 전날 예약하고 오후 12시에 와서보니 만석이라니요~~정말 놀랬네요. 셰프님께서 설명도 잘해주시고 끊임없이 나와서 배 불러서 혼났네요 ㅎㅎ 생일이라고 하니 스시도 더 챙겨주시고 마지막에 조각케이크까지 신랑도 너무 너무 좋았했어요! 다음에 또또 올거에요~ 셰프님 영광이었습니당! ㅎㅎ,아이 생일이라 다녀왔어요. 음식에 대해 친절히 설명해 주시고 룸으로 예약해서 저희끼리 식사 잘 하고 왔습니다.생일이라고 하니 조각케익 아이가 좋아하는 회도 서비스로 주셨어요. 엄청 맛있게 잘 먹고 왔습니다. 꼭 가보세요~ 후회하지 않으실 겁니다. 강추입니다!,카페알로   커피맛도 맛있고 불고기포케보울도  너무 맛있어요 매장도 깔끔하고 친절했어요   하남 미사쪽에 올때면 생각나는 곳이예요  다음엔 다른 메뉴들도 다 맛보구싶네요 오늘 시킨 메뉴도 성공
